[{"id":"aws.ec2.instance","n":"Amazon EC2 Instance","v":"aws","s":"ec2.instance","c":["compute"],"t":[],"vv":["default"],"dv":"default"},{"id":"azure.storage.blob","n":"Azure Storage Blob","v":"azure","s":"storage.blob","c":["storage"],"t":["blob"],"vv":["default"],"dv":"default"},{"id":"gcp.cloud-run.jobs","n":"Cloud Run Jobs","v":"gcp","s":"cloud-run.jobs","c":["compute"],"t":["serverless"],"vv":["default"],"dv":"default"}]